titre,description,lieu,image
"Wonderland I, 1993","Iron and light, 38 elements, 240 x 82 x 4 cm each","Installation view at Wonderland. Galerí­a Gamarra-Garrigues, Madrid, Spain 1994",https://jaumeplensa.com/gestorPlensa/images/entradas/entrada-40/72-Wonderland%20I%2C%20b.jpg
"Paris I, II, III, 1989","Iron, 250 x 250 x 250 cm each","Private Collection, Paris, France",https://jaumeplensa.com/gestorPlensa/images/entradas/entrada-40/4-Paris-i-ii-iii.jpg
"Les Hores, 1989","Iron, 100 x 380 x 330 cm","Private Collection, Lausanne, Switzerland",https://jaumeplensa.com/gestorPlensa/images/entradas/entrada-40/3-hores-pauli.jpg
"Dona de Vent I, 1989","Iron, 230 x 80 x 80 cm","Private Collection, Lausanne, Switzerland",https://jaumeplensa.com/gestorPlensa/images/entradas/entrada-40/1-dona-vent-pauli.jpg
"451, 1988","Iron, 200 x 200 x 200 cm",,https://jaumeplensa.com/gestorPlensa/images/entradas/entrada-40/2-451-france.JPG
