titre,description,lieu,image
"Constel·lacions, 2022","Stainless steel, 3 elements of 410 x 370 x 40 cm each","Gran Teatre del Liceu, Barcelona",https://jaumeplensa.com/gestorPlensa/images/entradas/entrada-40/113_constellacions.jpg
"Water's Soul, 2020","Polyester resin and marble dust, 22 meter high","Newport, Jersey City, NJ, USA",https://jaumeplensa.com/gestorPlensa/images/entradas/entrada-40/112_waters-soul.jpg
"Utopia, 2021","Marble, 4 portraits of 5,8 x 26 meters each","Frederik Meijer Garden &amp; Sculpture Park, Grand Rapids, MI, USA",https://jaumeplensa.com/gestorPlensa/images/entradas/entrada-40/111_utopia.jpg
"Talaia, 2017","Polyester resin and marble dust, 1400 x 478 x 703 cm","Lanai, Hawaii, USA 2021",https://jaumeplensa.com/gestorPlensa/images/entradas/entrada-40/107_talaia-lanai.jpg
"Behind the Walls, 2018","Polyester resin and marble dust, 750 x 278 x 310 cm","UMMA-University of Michigan Museum of Art, Ann Arbor, Michigan, USA",https://jaumeplensa.com/gestorPlensa/images/entradas/entrada-40/1_umma.jpg
"Nuria, 2017","Stainless steel, 350 x 275 x 344 cm","Philadelphia Museum of Art, Philadelphia, PA, USA. Gift of Aileen and Brian Roberts",https://jaumeplensa.com/gestorPlensa/images/entradas/entrada-40/106_nuria-philadelphia.jpg
"Julia, 2017","Cast iron, 700 x 238 x 95 cm","Installation view at Östra Strandgatan, Umeå, Sweden. Private Collection, Umeå",https://jaumeplensa.com/gestorPlensa/images/entradas/entrada-40/107_julia_umea.jpg
"Carlota (oak) / Wilsis (oak) / Julia (oak) / Laura Asia (oak), 2019","Bronze, variable dimensions","Installation view at Field of Dreams. Parrish Art Museum, Water Mill, New York, USA 2020",https://jaumeplensa.com/gestorPlensa/images/entradas/entrada-40/98_parrish-art-museum.jpg
"Dreaming, 2017","Polyester resin and marble dust, 850 x 109 x 310 cm","Richmond Adelaide Centre, 100 Adelaide St. W, Toronto, Canada",https://jaumeplensa.com/gestorPlensa/images/entradas/entrada-40/103_dreaming_toronto.jpg
"Carlota, 2020","Bronze, 450 x 180 x 62 cm","Private Collection, Netherlands",https://jaumeplensa.com/gestorPlensa/images/entradas/entrada-40/97_carlota-rotterdam.jpg
"Behind the Walls, 2018","Polyester resin and marble dust, 750 x 278 x 310 cm","Installation view at Rockefeller Center, New York, USA 2019",https://jaumeplensa.com/gestorPlensa/images/entradas/entrada-40/101_behind-the-walls_rockefeller.jpg
"Anna, 2018","Stainless steel, 400 x 282 x 382 cm","Installation view at Museu de Montserrat, Abadia de Montserrat, Barcelona, Spain 2019. Collection Pérez Art Museum Miami, USA",https://jaumeplensa.com/gestorPlensa/images/entradas/entrada-40/96_anna-montserrat.JPG
"Silencio, 2018","Polyester resin, marble dust and stainless steel, 1560 x 245 x 190 cm","Collection Fundación María Cristina Masaveu Peterson, Madrid, Spain",https://jaumeplensa.com/gestorPlensa/images/entradas/entrada-40/94_silencio-masaveu.jpg
"Carlota, 2017","Cast iron, 700 x 287 x 93 cm","Installation view at Sculpture in the Courtyard. Hermitage Museum, St. Petersburg, Russia 2019",https://jaumeplensa.com/gestorPlensa/images/entradas/entrada-40/83_carlota-hermitage.jpg
"Voices, 2017","Stainless steel, 11 elements of variable dimensions","30 Hudson Yards, New York, USA",https://jaumeplensa.com/gestorPlensa/images/entradas/entrada-40/97_voices_new-york.jpg
"Self-portrait with Music, 2018","Corten iron, 325 cm ø","Installation view at MACBA-Museu d'Art Contemporani de Barcelona, Spain 2018",https://jaumeplensa.com/gestorPlensa/images/entradas/entrada-40/63-Selfportrait-music-macba.jpg
"Les trois alchimistes, 2018","Bronze, 3 elements: 430 x 142 x 145 cm / 431 x 149 x 141 cm / 429 x 149 x 156 cm","Fondation Carmignac, Porquerolles, France",https://jaumeplensa.com/gestorPlensa/images/entradas/entrada-40/94_trois-alchimistes.jpg
"Source, 2017","Painted stainless steel, 1000 x 699 x 735 cm","Bonaventure Gateway, Montreal, Canada",https://jaumeplensa.com/gestorPlensa/images/entradas/entrada-40/93_source_montreal.jpg
"Mar Whispering, 2017","Marble, 250 x 87 x 107 cm","Collection At Six Hotel, Stockholm, Sweden",https://jaumeplensa.com/gestorPlensa/images/entradas/entrada-40/73-mar-whispering_at-six.jpg
"Lou, 2017","Marble, 274 x 92 x 121 cm","Private Collection, Belgium",https://jaumeplensa.com/gestorPlensa/images/entradas/entrada-40/88-lou-brussels.jpg
"Ainsa VI, 2017 (detail)","Stainless steel and stone, 348 x 234 x 365 cm","Collection Artipelag, Gustavsberg, Stockholm, Sweden",https://jaumeplensa.com/gestorPlensa/images/entradas/entrada-40/92_ainsaVI-artipelag.JPG
"Ainsa VI, 2017","Stainless steel and stone, 348 x 234 x 365 cm","Collection Artipelag, Gustavsberg, Stockholm, Sweden",https://jaumeplensa.com/gestorPlensa/images/entradas/entrada-40/91_ainsaVI-artipelag.JPG
"Ainsa VI, 2017","Stainless steel and stone, 348 x 234 x 365 cm","Collection Artipelag, Gustavsberg, Stockholm, Sweden",https://jaumeplensa.com/gestorPlensa/images/entradas/entrada-40/66-ainsaVI-artipelag.JPG
"Ainsa V, 2017","Stainless steel and stone, 362 x 216 x 329 cm","Private Collection, Virginia, USA",https://jaumeplensa.com/gestorPlensa/images/entradas/entrada-40/67-ainsa-V_virginia.jpg
"Sinfín III, 2017","Painted stainless steel, 164 x 130 x 150 cm","Private Collection, Cabo San Lucas, México",https://jaumeplensa.com/gestorPlensa/images/entradas/entrada-40/69-sinfin-iii-mexico.jpg
"Isabella Whispering, 2016","Marble, 220 x 73 x 110 cm","Private Collection, Tokyo, Japan",https://jaumeplensa.com/gestorPlensa/images/entradas/entrada-40/70-isabella-whispering.jpg
"Sanna, 2016","Polyester resin and marble dust, 1200 x 440 x 362 cm","Collection The Donum Estate, Sonoma, California, USA",https://jaumeplensa.com/gestorPlensa/images/entradas/entrada-40/86-Sanna-napa.jpg
"East Pacific's Soul, 2016","Stainless steel, 300 x 223 x 225 cm","Private Collection, Japan",https://jaumeplensa.com/gestorPlensa/images/entradas/entrada-40/70-east-pacific-soul_tokyo.JPG
"White Forest (Isabella), 2015","Bronze, Ed. of 5, 198 x 88 x 96 cm",Private Collection,https://jaumeplensa.com/gestorPlensa/images/entradas/entrada-40/84_White-Forest-Isabella.jpg
"Anna, 2015","Polyester resin and marble dust, 1400 x 430 x 570 cm","Pilane Heritage Museum, Klövedal, Sweden",https://jaumeplensa.com/gestorPlensa/images/entradas/entrada-40/83_anna-pilane.jpg
"Luzma, 2015","Stainless steel, 1000 x 678 x 850 cm","Private Collection, Mexico",https://jaumeplensa.com/gestorPlensa/images/entradas/entrada-40/82_luzma-mexico.JPG
"Mirall, 2015","Painted stainless steel, 377 x 235 x 245 cm each","Allen Institute for Artificial Intelligence, Seattle, Washington, USA",https://jaumeplensa.com/gestorPlensa/images/entradas/entrada-40/mirall_allen-institute.jpg
"Self-portrait, 2013","Stainless steel, 325 x 350 x 350 cm","Installation view at Human Landscape. Cheekwood Estate &amp; Gardens, Nashville, Tennessee, USA 2015",https://jaumeplensa.com/gestorPlensa/images/entradas/entrada-40/80_Selfportrait_nashville.jpg
"Duna, 2014","Cast iron, 700 x 280 x 86 cm","Collection Erasmus MC, Rotterdam, Netherlands",https://jaumeplensa.com/gestorPlensa/images/entradas/entrada-40/Duna_rotterdam.jpg
"Mist, 2014","Stainless steel, 525 x 531 x 421 cm","Installation view at Together. Collateral Event of the 56th International Venice Biennale, Basilica di San Giorgio Maggiore, Venice, Italy 2015. Private Collection, USA",https://jaumeplensa.com/gestorPlensa/images/entradas/entrada-40/72-Mist-venice.jpg
"Awilda &amp; Irma, 2014","Stainless steel, 400 x 400 x 300 cm each","Installation view at Human Landscape. Cheekwood Estate &amp; Gardens, Nashville, Tennessee, USA 2015. Private Collection, USA",https://jaumeplensa.com/gestorPlensa/images/entradas/entrada-40/69-Awilda-Irma-Nashville.jpg
"Duna, 2014","Cast iron, 700 x 280 x 86 cm","Installation view at Artzuid. International Sculpture Route, Amsterdam, Netherlands 2015. Collection Erasums MC, Rotterdam, Netherlands",https://jaumeplensa.com/gestorPlensa/images/entradas/entrada-40/76_duna-artzuid.jpg
"Laura, 2013 and Awilda, 2014","Basalt, 215 x 71 x 70 cm / 201 x 75 x 70 cm","Palm Springs Art Museum, California, USA",https://jaumeplensa.com/gestorPlensa/images/entradas/entrada-40/75_Awilda-Laura-palm-springs.jpg
"Rui Rui, 2014","Cast iron, 450 x 205 x 66 cm","Private Collection, USA",https://jaumeplensa.com/gestorPlensa/images/entradas/entrada-40/74_rui-rui-santafe.JPG
"Inés, 2013","Cast iron, 703 x 255 x 87 cm","Harvard Business School, Boston, Massachusetts, USA",https://jaumeplensa.com/gestorPlensa/images/entradas/entrada-40/67-Ines-harvard.jpg
"Paula, 2013","Cast iron, 703 x 255 x 98 cm","The Toledo Museum of Art, Toledo, Ohio, USA",https://jaumeplensa.com/gestorPlensa/images/entradas/entrada-40/PaulaPlensaToledoMuseum.jpg
"Rui Rui, 2013","Cast iron, 703 x 320 x 92 cm","Glasstress White Light / White Heat. Palazzo Cavalli-Franchetti, Collateral Event of the 55th Venice Biennale, Italy 2013. Collection The Flag Art Foundation, New York, USA",https://jaumeplensa.com/gestorPlensa/images/entradas/entrada-40/RuiRui%20venezia%20FA1.jpg
"Memoria, 2013"," Stainless steel, 400 x 247 x 283 cm","Double Cove Collection, Hong Kong",https://jaumeplensa.com/gestorPlensa/images/entradas/entrada-40/4-Memoria1.JPG
"Earth and Fire, 2012","Polyester resin, stainless steel and light, 8 meter high each","Installation view at Poets in Miami. Art Public-Art Basel, Collins Park, Miami, USA 2012",https://jaumeplensa.com/gestorPlensa/images/entradas/entrada-40/D93K6517%20GRAN.jpg
"Awilda in Bamberg, 2012"," Marble, 201 x 146 x 48 cm"," Installation view at Bamberg Cathedral, Bamberg, Germany 2012",https://jaumeplensa.com/gestorPlensa/images/entradas/entrada-40/14-AwildainBamberg1.jpg
"Kneeled Shadow II, 2009","Stainless steel and stone, 230 x 180 x 230 cm","Installation view at Skulptur i Pilane 2012. Klövedal, Sweden 2012. Private Collection, USA",https://jaumeplensa.com/gestorPlensa/images/entradas/entrada-40/58-kneeleg-shadow-II_pilane.JPG
"House of Knowledge, 2008"," Painted stainless steel, 800 x 550 x 530 cm","Installation view at Beyond Limits. Sotheby's at Chatsworth, Derbyshire, UK 2008. Collection Textile Fashion Center, Borås, Sweden",https://jaumeplensa.com/gestorPlensa/images/entradas/entrada-40/21-Jaume%20Plensa_5.jpg
"House of Knowledge, 2008","Stainless steel, 800 x 550 x 530 cm","Installation view at Kiev Sculpture Project, Kiev, Ukraine 2012. Collection Textile Fashion Center, Borås, Sweden",https://jaumeplensa.com/gestorPlensa/images/entradas/entrada-40/57-hok-kiev.jpg
"Twentynine Palms, 2007","Stainless steel, 29 elements of variable dimensions","Collection Umeå University Library, Umeå, Sweden",https://jaumeplensa.com/gestorPlensa/images/entradas/entrada-40/69-twentynine-palms_umea.jpg
"Twentynine Palms, 2007","Stainless steel, variable dimensions","Installation view at Umedalen Skulptur, Focus on Jaume Plensa. Umeå, Sweden 2012. Collection Umeå University Library, Sweden",https://jaumeplensa.com/gestorPlensa/images/entradas/entrada-40/51-twentynine-palms-umea.jpg
"The Heart of Trees III, 2007"," Bronze, 7 elements of variable x 66 x 99 cm","Installation view at Shanghai Biennale 2012, Shanghai, China",https://jaumeplensa.com/gestorPlensa/images/entradas/entrada-40/16-IMG_3258.JPG
"Humming, 2011"," Marble and lead, 250 x 94 x 111 cm","Collection DeCordova Sculpture Park &amp; Museum, Massachusetts, USA",https://jaumeplensa.com/gestorPlensa/images/entradas/entrada-40/18-DSC05386.jpg
"Awilda and Chloe, 2011"," Marble, 300 x 82 x 104 cm / 300 x 84 x 108 cm","Grand Hyatt New York, New York, USA",https://jaumeplensa.com/gestorPlensa/images/entradas/entrada-40/15-IMG_5122.jpg
"La Llarga Nit (Blind), 2010","Polyester resin, stainless steel and light, 1200 x 148 x 205 cm","Installation view at Yorkshire Sculpture Park, Wakefield, UK 2011",https://jaumeplensa.com/gestorPlensa/images/entradas/entrada-40/LLN%20side%20pink.jpg
"The Heart of Trees, 2007","Bronze and tree, 7 elements of variable x 66 x 99 cm","Installation view at Yorkshire Sculpture Park, Wakefield, UK 2011",https://jaumeplensa.com/gestorPlensa/images/entradas/entrada-40/IMG_3993bis.jpg
"Soul XII, 2010","Stainless steel and stone, 290 x 190 x 225 cm","Private Collection, Cabo San Lucas, México ",https://jaumeplensa.com/gestorPlensa/images/entradas/entrada-40/JW_LosCabos_2015_WireSculpture%2014.jpg
"Nuria, 2007 &amp; Irma, 2010","Stainless steel, 400 x 400 x 300 / 400 x 290 x 390 cm","Private Collection, Boston, Massachusetts, USA",https://jaumeplensa.com/gestorPlensa/images/entradas/entrada-40/a_Nuria_Irma1.jpg
"Spiegel I and II, 2010"," Painted stainless steel, 377 x 235 x 245 cm each","Collection The Toledo Museum of Art, Toledo, Ohio, USA",https://jaumeplensa.com/gestorPlensa/images/entradas/entrada-40/10-SpiegelTMPhRichard%20Goodbody.jpg
"Even Shetia, 2010","Stone and light, variable dimensions","Towada Art Center, Aomori, Japan. Commissioned by Arts Towada / Fumio Nanjo &amp; Ass. 2010",https://jaumeplensa.com/gestorPlensa/images/entradas/entrada-40/even-shetia3_sadao-hotta.jpg
"Dialogue, 2009"," Polyester resin, stainless steel, light and marble pebbles, 243 x 200 x 155 cm / 230 x 214 x 173 cm","Collection Copperhill Mountain Lodge, Åre, Sweden",https://jaumeplensa.com/gestorPlensa/images/entradas/entrada-40/19-PH%20by%20JonasKullman.jpg
"We, 2008"," Painted stainless steel, 500 x 360 x 340 cm","Installation view at Transparency. Prague, Czech Republic 2009. Collection Würth Kunsthalle, Germany",https://jaumeplensa.com/gestorPlensa/images/entradas/entrada-40/13-FTT_CF003838.jpg
"Jerusalem, 2006","Bronze, rope, wood and wool, 9 pairs of gongs, 130 cm diameter each","Installation view at Espacio Cultural El Tanque, Tenerife, Canary Islands, Spain 2009",https://jaumeplensa.com/gestorPlensa/images/entradas/entrada-40/Jerusalem%20Tanque.jpg
"White Head, 2008"," Painted stainless steel, 240 x 145 x 200 cm","Collection Crosby Street Hotel, New York, USA",https://jaumeplensa.com/gestorPlensa/images/entradas/entrada-40/26-white-Head.jpg
"Nuria II, 2008"," Alabaster, 172 x 84 x 115 cm",,https://jaumeplensa.com/gestorPlensa/images/entradas/entrada-40/28-Nuria-II-oscar.jpg
"Where?, 2008"," Bronze and tree, 100 x 75 x 100 cm","Installation view at Mimmo Scognamiglio Artecontemporanea, Milan, Italy 2008",https://jaumeplensa.com/gestorPlensa/images/entradas/entrada-40/23-65-Where.jpg
"Overflow II, 2007"," Stainless steel, 223 x 245 x 255 cm","Installation view at La Riva de Acheronte, Im Dialog IX. Stadtkirche, Darmstadt, Germany 2008. Private Collection, Netherlands",https://jaumeplensa.com/gestorPlensa/images/entradas/entrada-40/27-D-1501_RJ.jpg
"Nomade, 2007"," Painted stainless steel, 800 x 550 x 530 cm","Installation view at Bastion Saint-Jaume, Musée Picasso, Antibes, France 2007. Collection Pappajohn Sculpture Park, Des Moines Art Center, Iowa, USA",https://jaumeplensa.com/gestorPlensa/images/entradas/entrada-40/39-IMG_0876.jpg
"Nomade, 2007"," Painted stainless steel, 800 x 550 x 530 cm","Installation view at Ocean Drive, Art Basel-Miami Beach, Florida, USA 2007. Collection Pappajohn Sculpture Park, Des Moines Art Center, Iowa, USA",https://jaumeplensa.com/gestorPlensa/images/entradas/entrada-40/40-1245NomadeJaume.jpg
"Twentynine Palms, 2007","Stainless steel, 29 elements of variable dimensions","Installation view at IVAM-Institut Valencià d'Art Modern de Valencia, Spain 2007. Collection Umeå University Library, Sweden",https://jaumeplensa.com/gestorPlensa/images/entradas/entrada-40/19.jpg
"Where Are You? I, II and III, 2007"," Polyester resin, stainless steel and light, 130 x 152 x 210 cm each","Installation view at IVAM-Valencia, Spain 2007. Collection Clarion Trondheim Hotel, Norway",https://jaumeplensa.com/gestorPlensa/images/entradas/entrada-40/34-Where-are-you-i-II-III.jpg
"Sho, 2007"," Painted stainless steel, 400 x 400 x 300 cm","Collection Meadows Museum, Dallas, USA",https://jaumeplensa.com/gestorPlensa/images/entradas/entrada-40/24-M820080423-1947-000558.jpg
"Overflow II, III and IV, 2006"," Stainless steel, 223 x 245 x 255 cm each","Installation view at MAMAC-Musée d'Art Moderne et d'Art Contemporain, Nice, France 2007",https://jaumeplensa.com/gestorPlensa/images/entradas/entrada-40/38-NICE1133.jpg
"Doors of Jerusalem I, II and III, 2006"," Polyester resin, stainless steel and light, 120 x 158 x 205 cm each","Installation view at MAMAC-Nice, France 2007. Collection North Carolina Museum of Art, Raleigh, USA",https://jaumeplensa.com/gestorPlensa/images/entradas/entrada-40/37-NICE1118.jpg
"Winter Kept us Warm III, 1999"," Glass, stainless steel and light, 400 x 200 x 200 cm","Installation view at Beyond Limits. Sotheby's at Chatsworth, Derbyshire, UK 2007",https://jaumeplensa.com/gestorPlensa/images/entradas/entrada-40/53-694D07010.jpg
"Where are You?, 2006","Snow and light, 2,000 cm diameter x 50 cm depth","The Snow Show, in collaboration with Norman Foster for the 20th Winter Olympic Games, Sestriere, Turin, Italy, 2006",https://jaumeplensa.com/gestorPlensa/images/entradas/entrada-40/58-The%20Snow%20Show.jpg
"Where are You?, 2006","Snow and light, 2,000 cm diameter x 50 cm depth","The Snow Show, in collaboration with Norman Foster for the 20th Winter Olympic Games, Sestriere, Turin, Italy, 2006",https://jaumeplensa.com/gestorPlensa/images/entradas/entrada-40/57-The%20Snow%20Show.jpg
"Jerusalem, 2006","Bronze, rope, wood and wool, 9 pairs of gongs, 130 cm diameter each","Installation view at Museu Es Baluard, Palma de Mallorca, Spain 2006",https://jaumeplensa.com/gestorPlensa/images/entradas/entrada-40/Jerusalem8.jpg
"Jerusalem, 2006","Bronze, rope, wood and wool, 9 pairs of gongs, 130 cm diameter each","Installation view at Museu Es Baluard, Palma de Mallorca, Spain 2006",https://jaumeplensa.com/gestorPlensa/images/entradas/entrada-40/Jerusalem4.jpg
"Primary Thoughts, 2001"," Stainless steel, psychiatric couch, light and sound, 290 x 264 x 264 cm","Installation view at Is Art Something in Between?. Kunsthalle Mannheim, Mannheim, Germany 2006. Collection Museo Würth La Rioja, Spain",https://jaumeplensa.com/gestorPlensa/images/entradas/entrada-40/41-Mannheim.jpg
"I, You, She or He, 2006"," Stainless steel and stone, 288 x 197 x 172 cm / 280 x 266 x 240 cm / 280 x 266 x 195 cm","Collection Frederik Meijer Gardens and Sculpture Park, Grand Rapids, Michigan, USA 2008",https://jaumeplensa.com/gestorPlensa/images/entradas/entrada-40/29-I-you-she-or-he-Hebert2.jpg
"Song of Songs, 2005","Iron, variable dimensions","Installation view at CAC-Centro de Arte Contemporáneo, Málaga, Spain 2005",https://jaumeplensa.com/gestorPlensa/images/entradas/entrada-40/GK4R7168.jpg
"Song of Songs III and IV, 2004"," Glass, stainless steel and light, 220 x 90 x 81 cm each","Installation view at CAC-Málaga, Spain 2005. Collection Nasher Sculpture Center, Dallas, USA",https://jaumeplensa.com/gestorPlensa/images/entradas/entrada-40/42-GK4R7154.jpg
"Silent Rain, 2003"," Iron, 8 elements of variable dimensions","Installation view at Silent Noise. The Arts Club of Chicago, Chicago, USA 2004. Collection Susan Camilli Foundation, New York, USA",https://jaumeplensa.com/gestorPlensa/images/entradas/entrada-40/45-Silent%20Rain%20CH.JPG
"Sogni in Bianco e Nero?, 2003","Glass and iron, 215 x 430 x 435 cm","Installation view at Fiumi e cenere. Palazzo delle Papesse, Centro Arte Contemporanea, Siena, Italy 2004",https://jaumeplensa.com/gestorPlensa/images/entradas/entrada-40/43-1-7-Sogni.jpg
"Tel Aviv Man I, 2003"," Iron, 184 x 94 x 96 cm","Installation view at Fiumi e cenere. Palazzo delle Papesse, Centro Arte Contemporanea, Siena, Italy 2004. Private Collection, Lisbon, Portugal",https://jaumeplensa.com/gestorPlensa/images/entradas/entrada-40/44-Tel%20Aviv%20Italia.jpg
"Tattoo I, 2003"," Polyester resin, stainless steel and light, 226 x 130 x 95 cm","Installation view at Silent Noise. Massachusetts University, Amherst, USA 2004. Private Collection Aspen, Colorado, USA",https://jaumeplensa.com/gestorPlensa/images/entradas/entrada-40/46-Tattoo%20I.jpg
"Crystal Rain I, 2003","Glass, stainless steel and light, 236 x 120 x 120 cm","Installation view at Crystal Rain. Galerie Lelong &amp; Co. Paris, France 2003",https://jaumeplensa.com/gestorPlensa/images/entradas/entrada-40/22-Crystal-rain-lelong.jpg
"Freud's Children, 2002"," Mixed media, water pump and water, 23 elements of variable dimensions","Installation view at Mario Mauroner Contemporary Art, Salzburg, Austria 2003",https://jaumeplensa.com/gestorPlensa/images/entradas/entrada-40/48-Freuds%20Children1%20Salzburg.jpg
"Poet's Chair, 2002","Iron, glass, plastic and light, variable x 80 x 180 cm",,https://jaumeplensa.com/gestorPlensa/images/entradas/entrada-40/44%20POET%60S%20CHAIR.jpg
"Am I?, Who Why?, Life Yes? No?, 2002"," Glass and stainless steel, 264 x 160 x 160 cm each","Collection Museo Würth La Rioja, Spain",https://jaumeplensa.com/gestorPlensa/images/entradas/entrada-40/49-41-42-43%20c.JPEG
"El Corazón de las Palabras, 2000"," Glass, mirror, stainless steel and light, 304 x 164 x 164 cm","Collection Pérez Art Museum Miami, gift of TEGNA Inc.",https://jaumeplensa.com/gestorPlensa/images/entradas/entrada-40/54-El%20corazon%20de%20las%20palabras.jpg
"Lady Macbeth, The Traitor and The Porter, 2000","Glass, stainless steel and light, 231 x 89 x 90 cm each","Collection Fundación CAM, Spain and Private Collection, Italy",https://jaumeplensa.com/gestorPlensa/images/entradas/entrada-40/59-12-13-14-cabines.jpg
"Golden Sigh I, II and III, 1999"," Brass, wood, glass and light, 300 x 100 x 100 cm each","Installation view at Chaos-Saliva. Palacio de Velázquez-Museo Nacional Centro de Arte Reina Sofía, Madrid, Spain 2000",https://jaumeplensa.com/gestorPlensa/images/entradas/entrada-40/55-CHAOS-SALIVA.jpg
"Wispern, 1998"," Bronze, copper, rope and water, 21 elements of variable dimensions","Installation view at Chaos-Saliva. Palacio de Velázquez-Museo Nacional Centro de Arte Reina Sofí­a, Madrid, Spain 2000",https://jaumeplensa.com/gestorPlensa/images/entradas/entrada-40/51-Wispern%20expo%20reina.jpg
"Wonderland II, 1997","Paraffin, nylon and light, 38 elements, 241 x 60 x 10 cm each","Installation view at Chaos-Saliva. Palacio de Velázquez-Museo Nacional Centro de Arte Reina Sofía, Madrid, Spain 2000",https://jaumeplensa.com/gestorPlensa/images/entradas/entrada-40/58-Wonderland%20II.jpg
,"Installation view at Chaos-Saliva. Palacio de Velázquez - Museo Nacional Centro de Arte Reina Sofía, Madrid, Spain 2000",,https://jaumeplensa.com/gestorPlensa/images/entradas/entrada-40/60-Expo%20Sofia%201.jpg
"La Neige Rouge, 1991","Cast iron and neon light, 251 x 355 x 355 cm","Installation view at Chaos-Saliva. Palacio de Velázquez - Museo Nacional Centro de Arte Reina Sofía, Madrid, Spain 2000",https://jaumeplensa.com/gestorPlensa/images/entradas/entrada-40/69-LA%20NEIGE%20ROUGE%20F%20Miro.JPG
"Etwas Von Mir, 1999","Glass, iron, rope and stainless steel, 44 elements of variable dimensions","Installation view at Etwas von Mir. Kunsthalle zu Kiel, Kiel, Germany 2000. Private Collection, Switzerland",https://jaumeplensa.com/gestorPlensa/images/entradas/entrada-40/61-ETWAS%20VON%20MIR%201.jpg
,"Installation view at Tamada Projects Corporation, Tokyo, Japan, 1999",,https://jaumeplensa.com/gestorPlensa/images/entradas/entrada-40/TAMADA%20TOKYO%2C%201999%201%20A.JPG
"Winter Kept Us Warm II, 1998 / Scholars of War, Hotel Paris, Komm Mit! Komm Mit!, 1999","Polyester resin, iron and light, 258 x 123 x 110 cm each","Collection Fundación Caja de Burgos, Spain, and Private Collections",https://jaumeplensa.com/gestorPlensa/images/entradas/entrada-40/62-12%2016-SCHOLARS%20OF%20WAR%2C%20HOTEL%20PARIS%2C%20KOMM%20MIT%21%20KOMM%20MIT%211998-16%20WINTER%20KEPT%20US%20WARM%20II%202.jpg
"Wanderers Nachtlied, 1998","Nylon, iron, light and sound, 2 elements, 200 x 100 x 400 cm each","Installation view at Wanderers Nachtlied. Palais Liechtenstein, Vienna, Austria 1999",https://jaumeplensa.com/gestorPlensa/images/entradas/entrada-40/63-Wanderers%20Viena%202.jpg
"Love Sounds I, II, III, IV and V, 1998","Alabaster, stainless steel, iron, synthetic leather, sound and light, variable dimensions","Installation view at Love Sounds. Kestner Gesellschaft, Hannover, Germany 1999",https://jaumeplensa.com/gestorPlensa/images/entradas/entrada-40/65-Love%20Sounds%20Kestner%201.jpg
"Gemelli, 1998","Molten tempered glass, stainless steel and light, 255 x 205 x 205 cm","Gori Collection, Fattoria Celle, Santomato di Pistoia, Italy",https://jaumeplensa.com/gestorPlensa/images/entradas/entrada-40/64-Gemelli.jpg
"Meeting Point, 1997","Aluminium, 262 x 160 x 230 cm","Dallas?...Caracas?. The McKinney Avenue Contemporary Museum, Dallas, USA 1998. Collection Seven Bridges Foundation, Greenwich, Connecticut, USA",https://jaumeplensa.com/gestorPlensa/images/entradas/entrada-40/66-Meeting-Michael%20Baker.jpg
"Wie Ein Hauch, 1997","Glass, iron, brass and light, 410 x 102 x 204 cm","Installation view at Wie ein Hauch. Galerie Volker Diehl-Bewag Gebäude, Berlin, Germany 1997",https://jaumeplensa.com/gestorPlensa/images/entradas/entrada-40/67-WIE%20EIN%20HAUCH%20Berlin%202.jpg
"Twins I, 1993","Cast iron, steel and soil, 2 elements of variable dimensions","Installation view at The Personal Miraculous Fountain. The Henry Moore Studio, Dean Clough, Halifax, UK 1994",https://jaumeplensa.com/gestorPlensa/images/entradas/entrada-40/68-Twins%20I.jpg
"The Personal Miraculous Fountain, 1993","Bronze, water, soil and light, 250 x 140 x 200 cm","Installation view at The Personal Miraculous Fountain. The Henry Moore Studio, Dean Clough, Halifax, UK 1994",https://jaumeplensa.com/gestorPlensa/images/entradas/entrada-40/70-The%20Personal%20Miracoulus%20Fountain%20Henry%20Moore.jpg
